{"alias_policy":{"aliases":{},"mode":"off"},"bands":{"bands":["Cool","Open","Warm","Glow"],"clamp":[0,100],"edges":[24,49,74,100],"rounding":"ROUND_HALF_UP","schema":"band_edges.v1","source":"math/thresholds.json","version":"1"},"centers":["ajna","ego","g","head","root","sacral","solar_plexus","spleen","throat"],"channels":[{"centers":["g","throat"],"circuit_primary":"collective","domains":["narrative"],"flags":[],"gates":[1,8],"id":"01-08","primary_domain":"narrative","substream":null},{"centers":["sacral","g"],"circuit_primary":"tribal","domains":["bonding_feel","rhythm"],"flags":[],"gates":[2,14],"id":"02-14","primary_domain":"bonding_feel","substream":null},{"centers":["sacral","root"],"circuit_primary":"tribal","domains":["rhythm"],"flags":["format"],"gates":[3,60],"id":"03-60","primary_domain":"rhythm","substream":null},{"centers":["head","ajna"],"circuit_primary":"collective","domains":["narrative"],"flags":[],"gates":[4,63],"id":"04-63","primary_domain":"narrative","substream":"logic"},{"centers":["sacral","g"],"circuit_primary":"tribal","domains":["bonding_feel","rhythm"],"flags":[],"gates":[5,15],"id":"05-15","primary_domain":"bonding_feel","substream":null},{"centers":["sacral","solar_plexus"],"circuit_primary":"individual","domains":["narrative"],"flags":[],"gates":[6,59],"id":"06-59","primary_domain":"narrative","substream":"sensing"},{"centers":["g","throat"],"circuit_primary":"collective","domains":["narrative"],"flags":[],"gates":[7,31],"id":"07-31","primary_domain":"narrative","substream":null},{"centers":["sacral","root"],"circuit_primary":"tribal","domains":["rhythm"],"flags":["format"],"gates":[9,52],"id":"09-52","primary_domain":"rhythm","substream":null},{"centers":["g","throat"],"circuit_primary":"collective","domains":["talk"],"flags":[],"gates":[10,20],"id":"10-20","primary_domain":"talk","substream":null},{"centers":["sacral","g"],"circuit_primary":"tribal","domains":["bonding_feel","rhythm"],"flags":[],"gates":[10,34],"id":"10-34","primary_domain":"bonding_feel","substream":null},{"centers":["spleen","g"],"circuit_primary":"individual","domains":["bonding_feel","rhythm"],"flags":[],"gates":[10,57],"id":"10-57","primary_domain":"bonding_feel","substream":"knowing"},{"centers":["ajna","throat"],"circuit_primary":"collective","domains":["talk","narrative"],"flags":[],"gates":[11,56],"id":"11-56","primary_domain":"talk","substream":"logic"},{"centers":["solar_plexus","throat"],"circuit_primary":"individual","domains":["talk","action_voice"],"flags":["direct_mt"],"gates":[12,22],"id":"12-22","primary_domain":"action_voice","substream":"sensing"},{"centers":["g","throat"],"circuit_primary":"collective","domains":["narrative"],"flags":[],"gates":[13,33],"id":"13-33","primary_domain":"narrative","substream":null},{"centers":["spleen","throat"],"circuit_primary":"individual","domains":["talk","action_voice"],"flags":[],"gates":[16,48],"id":"16-48","primary_domain":"action_voice","substream":"knowing"},{"centers":["ajna","throat"],"circuit_primary":"collective","domains":["talk","narrative"],"flags":[],"gates":[17,62],"id":"17-62","primary_domain":"talk","substream":"logic"},{"centers":["spleen","root"],"circuit_primary":"individual","domains":["rhythm"],"flags":[],"gates":[18,58],"id":"18-58","primary_domain":"rhythm","substream":"knowing"},{"centers":["root","solar_plexus"],"circuit_primary":"individual","domains":["rhythm"],"flags":[],"gates":[19,49],"id":"19-49","primary_domain":"rhythm","substream":"sensing"},{"centers":["sacral","throat"],"circuit_primary":"collective","domains":["talk","action_voice"],"flags":["direct_mt"],"gates":[20,34],"id":"20-34","primary_domain":"action_voice","substream":null},{"centers":["spleen","throat"],"circuit_primary":"individual","domains":["narrative"],"flags":[],"gates":[20,57],"id":"20-57","primary_domain":"narrative","substream":"knowing"},{"centers":["ego","throat"],"circuit_primary":"collective","domains":["talk","action_voice"],"flags":["direct_mt"],"gates":[21,45],"id":"21-45","primary_domain":"action_voice","substream":null},{"centers":["ajna","throat"],"circuit_primary":"collective","domains":["talk","narrative"],"flags":[],"gates":[23,43],"id":"23-43","primary_domain":"talk","substream":"logic"},{"centers":["head","ajna"],"circuit_primary":"collective","domains":["narrative"],"flags":[],"gates":[24,61],"id":"24-61","primary_domain":"narrative","substream":"logic"},{"centers":["ego","g"],"circuit_primary":"tribal","domains":["bonding_feel","rhythm"],"flags":[],"gates":[25,51],"id":"25-51","primary_domain":"bonding_feel","substream":null},{"centers":["ego","spleen"],"circuit_primary":"individual","domains":["narrative"],"flags":[],"gates":[26,44],"id":"26-44","primary_domain":"narrative","substream":"knowing"},{"centers":["sacral","spleen"],"circuit_primary":"individual","domains":["narrative"],"flags":[],"gates":[27,50],"id":"27-50","primary_domain":"narrative","substream":"knowing"},{"centers":["spleen","root"],"circuit_primary":"individual","domains":["rhythm"],"flags":[],"gates":[28,38],"id":"28-38","primary_domain":"rhythm","substream":"knowing"},{"centers":["sacral","g"],"circuit_primary":"tribal","domains":["bonding_feel","rhythm"],"flags":[],"gates":[29,46],"id":"29-46","primary_domain":"bonding_feel","substream":null},{"centers":["root","solar_plexus"],"circuit_primary":"individual","domains":["rhythm"],"flags":[],"gates":[30,41],"id":"30-41","primary_domain":"rhythm","substream":"sensing"},{"centers":["spleen","root"],"circuit_primary":"individual","domains":["rhythm"],"flags":[],"gates":[32,54],"id":"32-54","primary_domain":"rhythm","substream":"knowing"},{"centers":["sacral","spleen"],"circuit_primary":"individual","domains":["narrative"],"flags":[],"gates":[34,57],"id":"34-57","primary_domain":"narrative","substream":"knowing"},{"centers":["solar_plexus","throat"],"circuit_primary":"individual","domains":["talk","action_voice"],"flags":["direct_mt"],"gates":[35,36],"id":"35-36","primary_domain":"action_voice","substream":"sensing"},{"centers":["solar_plexus","ego"],"circuit_primary":"individual","domains":["narrative"],"flags":[],"gates":[37,40],"id":"37-40","primary_domain":"narrative","substream":"sensing"},{"centers":["root","solar_plexus"],"circuit_primary":"individual","domains":["rhythm"],"flags":[],"gates":[39,55],"id":"39-55","primary_domain":"rhythm","substream":"sensing"},{"centers":["sacral","root"],"circuit_primary":"tribal","domains":["rhythm"],"flags":["format"],"gates":[42,53],"id":"42-53","primary_domain":"rhythm","substream":null},{"centers":["head","ajna"],"circuit_primary":"collective","domains":["narrative"],"flags":[],"gates":[47,64],"id":"47-64","primary_domain":"narrative","substream":"logic"}],"domains":["action_voice","bonding_feel","narrative","rhythm","talk"],"magic10":{"caps":{"alignment":{"bounds":{"max":100,"min":0},"inputs":["vector_cohesion","axis_agreement"]},"balance":{"bounds":{"max":100,"min":0},"inputs":["equilibrium_score","counterweight_ratio"]},"comfort":{"bounds":{"max":100,"min":0},"inputs":["soothe_index","buffer_resilience"]},"communication":{"bounds":{"max":100,"min":0},"inputs":["signal_clarity","exchange_density"]},"consistency":{"bounds":{"max":100,"min":0},"inputs":["pattern_integrity","variance_stability"]},"creativity":{"bounds":{"max":100,"min":0},"inputs":["novelty_factor","expression_flow"]},"drive":{"bounds":{"max":100,"min":0},"inputs":["willpower_current","focus_pressure"]},"expansion":{"bounds":{"max":100,"min":0},"inputs":["growth_tendency","horizon_reach"]},"harmony":{"bounds":{"max":100,"min":0},"inputs":["rapport_delta","resonance_strength"]},"heat":{"bounds":{"max":100,"min":0},"inputs":["spark_intensity","momentum_flux"]}},"order":["harmony","heat","communication","alignment","comfort","consistency","expansion","creativity","drive","balance"],"schema":"magic10_config.v1","seeds":{"harmony":{"checksum_sha256":"5cd628fbc8516de20d6d0f9a8e804ac5d9ee36c38e276c0f067e84ccfd9f8c8d","seed_version":"1.0.0","template_id":"T1","updated_at_utc":"2025-11-02T00:00:00Z"},"heat":{"checksum_sha256":"4d41dc3d2c14eb0f2cdb3a335f6817f98b116a210a1872c7ce1e78dd4da112b1","seed_version":"1.0.0","template_id":"T2","updated_at_utc":"2025-11-02T00:00:00Z"}}},"schema":"config_bundle.be.v1","sources":{"band_edges":{"path":"artifacts/thresholds/band_edges.json","sha256":"7e8931934b147e8a2069e3d2e5c5febada250fb889a1fd6d53405a6dd9986e49","size_bytes":177},"magic10_config":{"path":"artifacts/thresholds/magic10_config.json","sha256":"222af0fdfc8f87ee2fa2ee326c83bffa0ab9fa840eac7180d294883a7aeec71d","size_bytes":1425},"registry_report":{"path":"artifacts/registry/registry_report.json","sha256":"e5748db34c5215faeb3b3d91dccdb68255b79efd2df123fca58f3a76057f31d2","size_bytes":5008}}}
